,topic,time,vender,header,body,url
0,日経クロステック トップ建築新製品（建設IT）,2006-03-27,,汎用機能が充実した三次元CAD 「建築Vision3 Ver3.00」,"コンピュータシステム研究所
      建築Vision3 Ver3.00
価格：63万円から




コンピュータシステム研究所は、三次元CAD「建築Vision3 Ver3.00」を発売した。汎用図作成機能の充実を図った建築専用三次元CADソフト。初心者でも手軽に使えることを念頭に置いてバージョンアップした。

基本システムに知識データベースを搭載しており、間取りと建具を入力するだけで三次元モデルを自動生成する。断面図やパース画、基礎伏せ図、設備計画図なども得られる。

価格は、基本システムが63万円から。




（出典：日経アーキテクチュア　2006年3月13日号「新製品」欄より）コンピュータシステム研究所は、三次元CAD「建築Vision3 Ver3.00」を発売した。汎用図作成機能の充実を図った建築専用三次元CADソフト。初心者でも手軽に使えることを念頭に置いてバージョンアップした。

基本システムに知識データベースを搭載しており、間取りと建具を入力するだけで三次元モデルを自動生成する。断面図やパース画、基礎伏せ図、設備計画図なども得られる。

価格は、基本システムが63万円から。",https://xtech.nikkei.com/kn/article/knp/product/20060327/0045/
