,topic,time,vender,header,body,url
0,日経クロステック トップ建築新製品（建設IT）,2006-03-27,,直感的に操作できる 「空間情報システムSIS」,"インフォマティクス
      空間情報システム「ＳＩＳ」

実売価格：都度見積もり

発売日：2006年１月27日





インフォマティクスは、地理情報システム「空間情報システムSIS」のバージョン6.2を発売した。




インターフェースを改良。ドラッグズーム機能、ライブラリビューや主題図ビューにプレビュー機能を追加した。虫眼鏡の大きさをカスタマイズできるなど、ユーザーごとの使
いやすさを追求した。直感的に操作できる。



プラグインソフトの利用を管理できる「アドインマネージャー」を追加。Oracle10gなどの外部データベースと直接、接続できる。EXIFやAutoCAD2004/2005の読み込み、
JPEG2000の出力も可能。





豊富な作図・編集機能を装備し、GPS端末への接続をサポートする。



（出典：日経コンストラクション　2006年3月10日号「新製品」欄より）インフォマティクスは、地理情報システム「空間情報システムSIS」のバージョン6.2を発売した。",https://xtech.nikkei.com/kn/article/knp/product/20060327/0046/
