,topic,time,vender,header,body,url
0,日経クロステック トップ建築2017年7月13日号,2017-07-12,,至福の村野建築ツアー（前編）,"何度か訪れたことのある目黒区総合庁舎でも、解説付きだと新たな発見がごろごろ。次回は6月17日に参加した「谷村美術館」（1983年）のツアーをリポート予定。（宮沢 洋）日経アーキテクチュアが近年掲載した記事群をテーマごとに1冊にまとめる「日経アーキテクチュアSelection」の第1弾です。テーマは「世界の木造デザイン」。新たな次元に突入した現代木造建築を、豊富な写真と資料で紹介します。欧米の高層木造ビル、3次元曲面木造のほか、国内の最新作も解説しました。特に「高層木造PICK UP」は、世界各地で実現あるいは計画中の木造高層ビルを、地域別にコンパクトにまとめ、ほかでは見ることができない内容になっています。判形：A4変形判（日経アーキテクチュアと同じ）
ページ数：192ページ
定価：本体2400円＋税
ISBN：978-4-8222-3837-7
発行日：2017年6月26日
詳細・購入",https://xtech.nikkei.com/kn/atcl/bldnad/15/170713/010500037/
