,topic,time,vender,header,body,url
0,日経クロステック トップ建築新製品（建設IT）,2006-06-12,,ユーデック、歩行者シミュレーションソフト「Legion Studio」を発売,"ユーデック
Legion Studio2006（Light版、Premium版、Professional版）

価格：30万7000円（Light版、税込）～




ユーデックは、地下鉄、鉄道のターミナル駅、空港などにおける歩行者(群集)の行動をシミュレーションするソフト「Legion Studio」を発売した。

個々の歩行者は、大きさ、歩行速度、個人空間などの属性を持ち、出発地点から目的地点までを一歩一歩進む。その進行方向に壁や柱などの障害物があれば方向を転換し、他の歩行者と動線が重なりそうな場合は、互いに衝突しないように行動するなど、実際の歩行者と同様の判断を行う。

こうして個々の歩行者の行動を積み上げて、群集行動を正確に再現、解析することにより、歩行密度、歩行速度、利用頻度、歩行時間などの指標を使って、屋内外の歩行空間の評価を行う。

地下鉄構内や空港のピーク時における縦横動線の検討、待合所、チケットブース、売店などの配置や数量の検討、サインや発着ボードの配置などの検討を行うことができる。

同ソフトの活用により、個々の歩行者にとって、より安全で快適な歩行空間になっているかどうかを事前にテストしながら、設計を進めることが可能となる。

空間データは世界標準フォーマットであるDXFファイルを直接インポートできるので、準備作業を大幅に短縮することができる。

この記事の目次へ戻るユーデックは、地下鉄、鉄道のターミナル駅、空港などにおける歩行者(群集)の行動をシミュレーションするソフト「Legion Studio」を発売した。

個々の歩行者は、大きさ、歩行速度、個人空間などの属性を持ち、出発地点から目的地点までを一歩一歩進む。その進行方向に壁や柱などの障害物があれば方向を転換し、他の歩行者と動線が重なりそうな場合は、互いに衝突しないように行動するなど、実際の歩行者と同様の判断を行う。

こうして個々の歩行者の行動を積み上げて、群集行動を正確に再現、解析することにより、歩行密度、歩行速度、利用頻度、歩行時間などの指標を使って、屋内外の歩行空間の評価を行う。

地下鉄構内や空港のピーク時における縦横動線の検討、待合所、チケットブース、売店などの配置や数量の検討、サインや発着ボードの配置などの検討を行うことができる。

同ソフトの活用により、個々の歩行者にとって、より安全で快適な歩行空間になっているかどうかを事前にテストしながら、設計を進めることが可能となる。

空間データは世界標準フォーマットであるDXFファイルを直接インポートできるので、準備作業を大幅に短縮することができる。",https://xtech.nikkei.com/kn/article/knp/product/20060612/0150/
