,topic,time,vender,header,body,url
0,日経クロステック トップ建築新製品・建材（建築・住宅）,2004-12-10,,リフォーム専用内装シートがリニューアル,"●既存の壁・床・天井に張るだけの、水回りのリフォーム専用シートがリニューアル。従来品からデザインを一新し、より上質な意匠性を提供するラインアップとした。特殊ポリエステル系素材の採用により脱塩ビ化を図るとともに、独自の粘着剤を使用することで作業性を改善した。
●価格は、1216サイズのユニット浴室への施工で（床・壁・天井）約20万円。
問合：住友スリーエム
電話：0570・012・123




（日経ホームビルダー2005年1月号）
この記事の目次へ戻る問合：住友スリーエム
電話：0570・012・123




（日経ホームビルダー2005年1月号）
この記事の目次へ戻る（日経ホームビルダー2005年1月号）
この記事の目次へ戻る（日経ホームビルダー2005年1月号）
この記事の目次へ戻る",https://xtech.nikkei.com/kn/article/building/info/20041210/119982/
