,topic,time,vender,header,body,url
0,日経クロステック トップ建築新製品・建材（建築・住宅）,2004-12-15,,システムアップできるドアホン,"センサーライトや住宅用火災警報器などと連動できるドアホン。操作が簡単なタッチパネルと見やすい3.5型TFTカラー液晶モニターを採用。画面にタッチするだけで、ハンズフリーで訪問者と通話できる。また、夜間照明（白色LED）を内蔵しているので、夜でもカラー画像で訪問者を確認できる。
価格は、モニター付き親機が5万3340円。カメラ付き玄関子機が2万5200円。
日経アーキテクチュア2004年12月27日号掲載
問い合わせ：アイホン
電話：052-682-3877



この記事の目次へ戻る日経アーキテクチュア2004年12月27日号掲載
問い合わせ：アイホン
電話：052-682-3877



この記事の目次へ戻る問い合わせ：アイホン
電話：052-682-3877



この記事の目次へ戻る",https://xtech.nikkei.com/kn/article/building/info/20041215/120069/
