,topic,time,vender,header,body,url
0,日経クロステック トップ建築新製品・建材（建築・住宅）,2005-01-14,,ピッキングできないドアロック,"本体に付属する鋼棒の上下移動で施錠／開錠するドアロックシステム。ピッキングやサムターン回し、カム送りなどの手口では開錠できない。リモコン装置での通常の操作に加えて、電話回線で施錠／開錠できるオプションを用意している。電池交換のタイミングを知らせるインジケーターランプ付き。バッテリーが残りわずかになると自動的に開錠する。

価格は、3万3800円。

日経アーキテクチュア2005年1月24日号掲載

問い合わせ：ユニオン

電話：03-3630-1208



この記事の目次へ戻る日経アーキテクチュア2005年1月24日号掲載

問い合わせ：ユニオン

電話：03-3630-1208



この記事の目次へ戻る問い合わせ：ユニオン

電話：03-3630-1208



この記事の目次へ戻る",https://xtech.nikkei.com/kn/article/building/info/20050114/120459/
