,topic,time,vender,header,body,url
0,日経クロステック トップ建築新製品・建材（建築・住宅）,2005-02-09,,リラクゼ－ション効果のあるハンドシャワー,"●湯に空気を混合する独自システムを搭載したハンドシャワー。同システムにより空気を含んだ水滴は、肌にやわらかな感触と温かさを伝え、リラクゼーション効果が得られる。直径150mmの大型ヘッドを採用。壁面へ設置してハンズフリーで使用できる、ウォールバーとのセットを用意。

●価格は、2万2260円。ウォールバーとのセットが7万8855円。

問合：ハンスグロ－エジャパン

電話：03・5424・1950





（日経ホームビルダー2005年3月号）
この記事の目次へ戻る問合：ハンスグロ－エジャパン

電話：03・5424・1950





（日経ホームビルダー2005年3月号）
この記事の目次へ戻る（日経ホームビルダー2005年3月号）
この記事の目次へ戻る（日経ホームビルダー2005年3月号）
この記事の目次へ戻るこの記事の目次へ戻る",https://xtech.nikkei.com/kn/article/building/info/20050209/120877/
