,topic,time,vender,header,body,url
0,日経クロステック トップ建築新製品・建材（建築・住宅）,2005-02-14,,光ファイバーを利用したセキュリティーシステム,"●独自構造の光ファイバーセンサーを用いた、住宅セキュリティーシステム。窓枠やドア枠に、同センサー内蔵のスイッチを取り付けるもの。開閉で生じる圧力により光ファイバー内に漏れる光の量を感知することで、窓やドアの状況を管理できる。電気式センサーに比べ約半額という低価格を実現。

●価格は、センサー8カ所の標準装備品が12万6000円。

問合：インターアクション

電話：045・788・8997





（日経ホームビルダー2005年3月号）
この記事の目次へ戻る問合：インターアクション

電話：045・788・8997





（日経ホームビルダー2005年3月号）
この記事の目次へ戻る（日経ホームビルダー2005年3月号）
この記事の目次へ戻る（日経ホームビルダー2005年3月号）
この記事の目次へ戻る",https://xtech.nikkei.com/kn/article/building/info/20050214/120966/
