,topic,time,vender,header,body,url
0,日経クロステック トップ建築新製品・建材（建築・住宅）,2005-02-14,,子どもや高齢者にも握りやすい 屋外歩行者用補助手すり,"●従来の歩行者用手すり（直径40mm）に、子どもや高齢者の比較的小さな手でも握りやすい、直径34mmのタイプを追加した。上下で径サイズの異なる2段式とするなど、ユニバーサルデザインに対応した構成も可能。カラーはアーバングレーなど3色と、木調塗装を用意している。

●価格は、写真の2段仕様のセット価格が1万4700円／m。

問合：三協アルミニウム工業

電話：0766・20・2264





（日経ホームビルダー2005年3月号）
この記事の目次へ戻る問合：三協アルミニウム工業

電話：0766・20・2264





（日経ホームビルダー2005年3月号）
この記事の目次へ戻る（日経ホームビルダー2005年3月号）
この記事の目次へ戻る（日経ホームビルダー2005年3月号）
この記事の目次へ戻る",https://xtech.nikkei.com/kn/article/building/info/20050214/120975/
