,topic,time,vender,header,body,url
0,日経クロステック トップ建築新製品・建材（建築・住宅）,2005-03-14,,陶磁器や自然石を配合したコテ仕上げによる塗材,"●アクリルシリコーン樹脂を結合材に、陶磁器破砕粒や自然石を配合した仕上げ塗材。深みのある質感が特徴で、多彩な色とパターンを表現できる。変色・退色が少なく、塗膜の効果により耐汚染性や耐候性が高いうえ、防藻・防カビ機能もある。コテ仕上げのため養生の手間が省け、工期短縮を図れる。

●価格は、6000～7000円／m2程度（300m2以上・材工共）。

問合：明研化学工業

電話：078・928・3466





（日経ホームビルダー2005年4月号）
この記事の目次へ戻る問合：明研化学工業

電話：078・928・3466





（日経ホームビルダー2005年4月号）
この記事の目次へ戻る（日経ホームビルダー2005年4月号）
この記事の目次へ戻る（日経ホームビルダー2005年4月号）
この記事の目次へ戻る",https://xtech.nikkei.com/kn/article/building/info/20050314/121504/
