,topic,time,vender,header,body,url
0,日経クロステック トップ建築新製品・建材（建築・住宅）,2005-04-08,,家庭的な趣の高齢者施設向け収納,"家庭的な趣のデザインの高齢者施設向け収納家具シリーズ。明るい色合いの木目を基調とし、木の温かみや優しさ、風合いを重視した。生活を楽しむインテリア家具としてデザインしている。収納力の高さに加えて、高齢者にとっての使いやすさや安全性にも配慮した。価格は、ドレッサー（引き出しタイプ）が7万2030円。3段チェストが8万640円。両開きワードローブが9万4290円など。

日経アーキテクチュア2005年4月18号掲載

問い合わせ：岡村製作所

電話：0120-819060



この記事の目次へ戻る日経アーキテクチュア2005年4月18号掲載

問い合わせ：岡村製作所

電話：0120-819060



この記事の目次へ戻る問い合わせ：岡村製作所

電話：0120-819060



この記事の目次へ戻る",https://xtech.nikkei.com/kn/article/building/info/20050408/121999/
