,topic,time,vender,header,body,url
0,日経クロステック トップ建築新製品・建材（建築・住宅）,2005-04-08,,無駄なく蓄熱する輻射式暖房器具,"料金が割安な夜間の電力を利用して蓄熱し、クリーンな輻射熱で室内を暖める暖房器具。夜間の余分な蓄熱を防ぐため、外気温に合わせて蓄熱量を調節するシーズンセンサーを搭載している。対流効果を付加したファンタイプは、設定室温と蓄熱残量に応じてファンの回転数を自動制御し、蓄えた熱を有効に放熱して室温を一定に保つ。

価格は、11万5500～37万8000円。

日経アーキテクチュア2005年4月18号掲載

問い合わせ：日本スティーベル

電話：03-3436-4662



この記事の目次へ戻る日経アーキテクチュア2005年4月18号掲載

問い合わせ：日本スティーベル

電話：03-3436-4662



この記事の目次へ戻る問い合わせ：日本スティーベル

電話：03-3436-4662



この記事の目次へ戻る",https://xtech.nikkei.com/kn/article/building/info/20050408/121995/
