,topic,time,vender,header,body,url
0,日経クロステック トップ建築新製品・建材（建築・住宅）,2005-05-11,,目地詰め不要のラップタイプ内外装壁タイル,"●目地詰めを必要としないラップタイプの内外装用タイル。タイル周辺の接着剤の盛り上がりを隠せるため、仕上がりがきれい。また、施工は積み上げ張りができるように、あいじゃくり部分に突起を形成した。形状は二丁掛け平と標準曲がりの2タイプで、カラーバリエーションは全5色。

●価格は、二丁掛け平4800円／m2。標準曲がり4400円／m2。

問合：ニッタイ工業

電話：0569・73・5121





（日経ホームビルダー2005年６月号）
この記事の目次へ戻る問合：ニッタイ工業

電話：0569・73・5121





（日経ホームビルダー2005年６月号）
この記事の目次へ戻る（日経ホームビルダー2005年６月号）
この記事の目次へ戻る（日経ホームビルダー2005年６月号）
この記事の目次へ戻る",https://xtech.nikkei.com/kn/article/building/info/20050511/122424/
