,topic,time,vender,header,body,url
0,日経クロステック トップ建築新製品・建材（建築・住宅）,2005-05-12,,家庭用高濃度人工炭酸泉装置の新ラインナップ,"●特殊な中空糸膜を使用し、高濃度の炭酸ガスを温水中に溶け込ませる人工温泉装置に、ビルトインタイプが加わった。本体を浴槽エプロン部に収納するため、すっきりした浴室を実現。リモコンボタン1つで、高濃度人工炭酸泉に入浴できる。自動洗浄機能付き。アクリル浴槽は、10種類6色を用意。

●価格については、問い合わせを。

問合：三菱レイヨン・エンジニアリング

電話：03・5495・3287





（日経ホームビルダー2005年６月号）
この記事の目次へ戻る問合：三菱レイヨン・エンジニアリング

電話：03・5495・3287





（日経ホームビルダー2005年６月号）
この記事の目次へ戻る（日経ホームビルダー2005年６月号）
この記事の目次へ戻る（日経ホームビルダー2005年６月号）
この記事の目次へ戻る",https://xtech.nikkei.com/kn/article/building/info/20050512/122436/
