,topic,time,vender,header,body,url
0,日経クロステック トップ建築新製品・建材（建築・住宅）,2005-06-09,,床下の湿気を吸収しシロアリを駆除する木炭,"●建築廃木材を調湿効果が高くなる780℃で炭化させた調湿用木炭。炭を袋に入れたまま床下に敷き詰めると湿気を吸収。床下木材の含水率を、シロアリが生育しづらい20％近くまで下げる。結露を防ぎ、カビやダニの発生を抑制。VOC吸着効果もあり、夏涼しく冬暖かい、快適な住環境を実現する。

●価格は、7840円／1帖。

問合：出雲カーボン

電話：0853・24・8808





（日経ホームビルダー2005年7月号）
この記事の目次へ戻る問合：出雲カーボン

電話：0853・24・8808





（日経ホームビルダー2005年7月号）
この記事の目次へ戻る（日経ホームビルダー2005年7月号）
この記事の目次へ戻る（日経ホームビルダー2005年7月号）
この記事の目次へ戻る",https://xtech.nikkei.com/kn/article/building/info/20050609/122980/
