,topic,time,vender,header,body,url
0,日経クロステック トップ建築新製品・建材（建築・住宅）,2005-08-09,,ローラー施工ができる多彩色仕上げの塗料,"●下塗りから仕上げまで、シンナーを使わないオール水系システムで、安全な作業が可能。トップコート不要で、施工工程が少なく、ゴンドラ作業にも適している。アクリルシリコンの採用により、高い耐候性と低汚染性を実現。下地材の凸凹を生かしたまま仕上げられるため、改修工事にも適する。

●価格は、3700円／m2。

問合：フジワラ化学

電話：0898・64・2421





（日経ホームビルダー2005年9月号）
この記事の目次へ戻る問合：フジワラ化学

電話：0898・64・2421





（日経ホームビルダー2005年9月号）
この記事の目次へ戻る（日経ホームビルダー2005年9月号）
この記事の目次へ戻る（日経ホームビルダー2005年9月号）
この記事の目次へ戻る",https://xtech.nikkei.com/kn/article/building/info/20050809/124136/
