,topic,time,vender,header,body,url
0,日経クロステック トップ建築新製品・建材（建築・住宅）,2005-09-09,,室内を多彩に演出する仕上塗材,"●カラーセラミックスと色染めした天然のワラを配合した内装用仕上塗材。主原料の有色陶磁器質骨材や天然石細粒により、多彩な色調が可能となった。高い消臭作用、珪藻土配合の調湿作用によって、室内をクリーンな空気に保つ。VOC対策に効果的で、防カビ・防藻性を持つ防火材料。22色を用意。

●価格は、2900円／m2（300m2の場合）。

問合：山本窯業化工

電話：06・6338・8705





（日経ホームビルダー2005年10月号）
この記事の目次へ戻る問合：山本窯業化工

電話：06・6338・8705





（日経ホームビルダー2005年10月号）
この記事の目次へ戻る（日経ホームビルダー2005年10月号）
この記事の目次へ戻る（日経ホームビルダー2005年10月号）
この記事の目次へ戻る",https://xtech.nikkei.com/kn/article/building/info/20050909/124663/
