,topic,time,vender,header,body,url
0,日経クロステック トップ建築新製品・建材（建築・住宅）,2005-09-09,,透過光演出フィルムに新アイテムを追加,"●窓やパーティションなどのクリアガラスに張るだけで曇りガラス調に透過光を柔らかく拡散するフィルムの新シリーズ。透明PETフィルムに微少のガラスビーズを使用し、タイル柄やストライプ柄など5種類のパターンを用意。ガラス飛散防止と紫外線カットに効果的で、防火認定も取得。

●価格は、8400円／m2～。

問合：リンテック

電話：03・3868・7733





（日経ホームビルダー2005年10月号）
この記事の目次へ戻る問合：リンテック

電話：03・3868・7733





（日経ホームビルダー2005年10月号）
この記事の目次へ戻る（日経ホームビルダー2005年10月号）
この記事の目次へ戻る（日経ホームビルダー2005年10月号）
この記事の目次へ戻る",https://xtech.nikkei.com/kn/article/building/info/20050909/124670/
