,topic,time,vender,header,body,url
0,日経クロステック トップ建築新製品・建材（建築・住宅）,2005-10-14,,浴室を癒しの空間に変える多機能シャワーシステム,"●操作性が高く、スタイリッシュなデザインの壁取り付けタイプの多機能シャワーシステム。ハンドシャワーと直径50mmのマルチジェットサイドシャワーによるスプレーが、心地よい刺激を与える。サーモスタット機能により、使用中の水圧変化にかかわらず、安定した湯温を保つことができる。

●価格は、19万4250円（1000タイプ）、22万5750円（2000タイプ／写真）。

問合：グローエジャパン

電話：03・3298・9685





（日経ホームビルダー2005年11月号）
この記事の目次へ戻る問合：グローエジャパン

電話：03・3298・9685





（日経ホームビルダー2005年11月号）
この記事の目次へ戻る（日経ホームビルダー2005年11月号）
この記事の目次へ戻る（日経ホームビルダー2005年11月号）
この記事の目次へ戻る",https://xtech.nikkei.com/kn/article/building/info/20051014/125385/
