,topic,time,vender,header,body,url
0,日経クロステック トップ建築新製品・建材（建築・住宅）,2006-02-13,,サムターン回しを防止する着脱式玄関ドア補助錠,"●サムターン回しを防ぐスイッチ式防犯サムターンに、着脱機能が加わった。万が一、扉に穴を開けるなどで内側に手を入れられても、サムターンをはずしておけば、回すことはできない。また、錠の取り付けネジをはずされても、錠本体を扉からはずすことができない工夫が施されている。

●価格については、問い合わせを。

問合：美和ロック

電話：0120・81・3069





（日経ホームビルダー３月号掲載）
この記事の目次へ戻る問合：美和ロック

電話：0120・81・3069





（日経ホームビルダー３月号掲載）
この記事の目次へ戻る（日経ホームビルダー３月号掲載）
この記事の目次へ戻る（日経ホームビルダー３月号掲載）
この記事の目次へ戻るこの記事の目次へ戻る",https://xtech.nikkei.com/kn/article/building/info/20060213/127516/
