,topic,time,vender,header,body,url
0,日経クロステック トップ建築フォトギャラリー,2006-11-13,佐野 由佳,築150年の民家を生かした町の新たな顔,"新旧の建物をつなぐのは、2層吹き抜けの通路「タイムギャラリー」。もともと、通り庭だったところだ（写真：細谷 陽二郎）


　兵庫県宝塚市は、22万人の人口の大半が南部に集中している。北部の西谷地域は、市の面積の半分近くを占めているが、人口は2％に満たない。土地の大半は山林と農地である。宝塚歌劇団や瀟洒（しょうしゃ）な住宅街に象徴される南部と対照的に、豊かな緑が広がるのどかな一帯だ。


西谷ふれあい夢プラザ（兵庫県宝塚市）
・設計：安井建築設計事務所
・施工：中武建設工業（建築）ほか新旧の建物をつなぐのは、2層吹き抜けの通路「タイムギャラリー」。もともと、通り庭だったところだ（写真：細谷 陽二郎）兵庫県宝塚市は、22万人の人口の大半が南部に集中している。北部の西谷地域は、市の面積の半分近くを占めているが、人口は2％に満たない。土地の大半は山林と農地である。宝塚歌劇団や瀟洒（しょうしゃ）な住宅街に象徴される南部と対照的に、豊かな緑が広がるのどかな一帯だ。西谷ふれあい夢プラザ（兵庫県宝塚市）
・設計：安井建築設計事務所
・施工：中武建設工業（建築）ほか会員の方はこちら有料会員「春割」実施中！【春割実施中】日経電子版セットで２カ月無料日経電子版セットだと日経クロステックが月々650円お得詳しくは日経クロステック有料会員お申し込みのページで。“特等席”から未来づくりの最前線を追う仕事ですあなたの専門知識や経験を生かして、「日経クロステック」の記事や書籍の企画、取材・執筆・編集を担う編集記者（正社員）にトライしませんか。編集の経験は問いません。コミュニケーション能力が高く、企画力や実行力があり、好奇心旺盛な方を求めています。詳しい情報を見る日経BPはエンジニアや企画・営業も募集中次ページ （前のページから続く）かねてから、「農産物を販売...",https://xtech.nikkei.com/kn/article/building/photo/20061126/501292/
