,topic,time,vender,header,body,url
0,日経クロステック トップ建築フォトギャラリー,2006-10-09,西山 麻夕美,厳しい自然環境を克服する奥行き3.3mの大庇,"南東側、玄関アプローチから見る。奥行き約3.3mの庇は軒天のこう配を工夫し、夏季の日差しカットと冬季の採光を両立した（写真：大竹 静市郎）


　敷地の北側は幹線道路が走り、その向こうにはうっそうとした竹林の山すそが広がる。南側は散策道路と川を挟んで小高い山が迫る。このような南北を山に囲まれたロケーションのため、日の短い冬場は午後3時すぎにあたりが暗くなってしまい、極端に日照が不足して厳しい寒さになる──。


飯能の家（埼玉県飯能市）
・設計：栗林賢次建築研究所
・施工：ノザワ建設南東側、玄関アプローチから見る。奥行き約3.3mの庇は軒天のこう配を工夫し、夏季の日差しカットと冬季の採光を両立した（写真：大竹 静市郎）敷地の北側は幹線道路が走り、その向こうにはうっそうとした竹林の山すそが広がる。南側は散策道路と川を挟んで小高い山が迫る。このような南北を山に囲まれたロケーションのため、日の短い冬場は午後3時すぎにあたりが暗くなってしまい、極端に日照が不足して厳しい寒さになる──。飯能の家（埼玉県飯能市）
・設計：栗林賢次建築研究所
・施工：ノザワ建設会員の方はこちら有料会員「春割」実施中！【春割実施中】日経電子版セットで２カ月無料日経電子版セットだと日経クロステックが月々650円お得詳しくは日経クロステック有料会員お申し込みのページで。“特等席”から未来づくりの最前線を追う仕事ですあなたの専門知識や経験を生かして、「日経クロステック」の記事や書籍の企画、取材・執筆・編集を担う編集記者（正社員）にトライしませんか。編集の経験は問いません。コミュニケーション能力が高く、企画力や実行力があり、好奇心旺盛な方を求めています。詳しい情報を見る日経BPはエンジニアや企画・営業も募集中次ページ （前のページから続く）その結果、南側に約3.3m...",https://xtech.nikkei.com/kn/article/building/photo/20061126/501289/
