,topic,time,vender,header,body,url
0,日経クロステック トップ建築フォトギャラリー,2006-09-11,西山 麻夕美,PCaブロックを積み上げた「ここだけの空間」,"神通川側からみたロビー。陰影の深い壁は、型枠兼仕上げ材のPCaブロック（写真：吉田 誠）


　富山県中部、神通峡春日温泉の一角にある、河畔の癒やしをテーマにしたホテル「リバーリトリート雅樂倶」。そのアネックスが2005年11月にオープンした。6年前に営業を始めた本館は、実業家の石?由則氏が企業の保養施設だった建物を買い取り、徹底的に改装したものだ。このとき、本館内の美術館と茶室のデザインを手掛けた建築家の内藤廣氏の腕を見込んで、アネックスの設計を依頼した。


リバーリトリート雅樂倶ANNEX（富山県富山市）
・設計：内藤廣建築設計事務所
・施工：鹿島・大林組・清水建設JV神通川側からみたロビー。陰影の深い壁は、型枠兼仕上げ材のPCaブロック（写真：吉田 誠）富山県中部、神通峡春日温泉の一角にある、河畔の癒やしをテーマにしたホテル「リバーリトリート雅樂倶」。そのアネックスが2005年11月にオープンした。6年前に営業を始めた本館は、実業家の石?由則氏が企業の保養施設だった建物を買い取り、徹底的に改装したものだ。このとき、本館内の美術館と茶室のデザインを手掛けた建築家の内藤廣氏の腕を見込んで、アネックスの設計を依頼した。リバーリトリート雅樂倶ANNEX（富山県富山市）
・設計：内藤廣建築設計事務所
・施工：鹿島・大林組・清水建設JV会員の方はこちら有料会員「春割」実施中！【春割実施中】日経電子版セットで２カ月無料日経電子版セットだと日経クロステックが月々650円お得詳しくは日経クロステック有料会員お申し込みのページで。“特等席”から未来づくりの最前線を追う仕事ですあなたの専門知識や経験を生かして、「日経クロステック」の記事や書籍の企画、取材・執筆・編集を担う編集記者（正社員）にトライしませんか。編集の経験は問いません。コミュニケーション能力が高く、企画力や実行力があり、好奇心旺盛な方を求めています。詳しい情報を見る日経BPはエンジニアや企画・営業も募集中次ページ （前のページから続く）石崎氏が要望した「ここだけ...",https://xtech.nikkei.com/kn/article/building/photo/20061126/501326/
