,topic,time,vender,header,body,url
0,日経クロステック トップ建築フォトギャラリー,2006-10-23,萩原 詩子,膜屋根をかぶせたらせん状ワンルーム,"「インナーデッキ」と名付けられた南側のコーナーから見た全景（写真：安川 千秋）


　敷地は約33坪（111m2）。正方形に近い整形だが、建ぺい率40％、風致条例による外壁後退1mという厳しい条件がつく。加えて、敷地内に約1.2mの高低差があった。「敷地の真ん中にしか建てられないので、建物も正方形にするしかない。高低差を利用して半地下をつくり、床面積を確保することも必要だった」と設計者の杉浦英一氏（杉浦英一建築設計事務所代表、東京都中央区）は語る。「建て主は夫婦2人暮らし。内部空間は、おのおのがどこにいても互いに様子が伝わるような、立体的ワンルームがいいと考えた」（同氏）。


立体・田の字プランの家（神奈川県藤沢市）
・設計：杉浦英一建築設計事務所
・施工：大同工業「インナーデッキ」と名付けられた南側のコーナーから見た全景（写真：安川 千秋）敷地は約33坪（111m2）。正方形に近い整形だが、建ぺい率40％、風致条例による外壁後退1mという厳しい条件がつく。加えて、敷地内に約1.2mの高低差があった。「敷地の真ん中にしか建てられないので、建物も正方形にするしかない。高低差を利用して半地下をつくり、床面積を確保することも必要だった」と設計者の杉浦英一氏（杉浦英一建築設計事務所代表、東京都中央区）は語る。「建て主は夫婦2人暮らし。内部空間は、おのおのがどこにいても互いに様子が伝わるような、立体的ワンルームがいいと考えた」（同氏）。立体・田の字プランの家（神奈川県藤沢市）
・設計：杉浦英一建築設計事務所
・施工：大同工業会員の方はこちら有料会員「春割」実施中！【春割実施中】日経電子版セットで２カ月無料日経電子版セットだと日経クロステックが月々650円お得詳しくは日経クロステック有料会員お申し込みのページで。“特等席”から未来づくりの最前線を追う仕事ですあなたの専門知識や経験を生かして、「日経クロステック」の記事や書籍の企画、取材・執筆・編集を担う編集記者（正社員）にトライしませんか。編集の経験は問いません。コミュニケーション能力が高く、企画力や実行力があり、好奇心旺盛な方を求めています。詳しい情報を見る日経BPはエンジニアや企画・営業も募集中次ページ （前のページから続く）杉浦氏はこれまでにも、田の...",https://xtech.nikkei.com/kn/article/building/photo/20061126/501301/
