,topic,time,vender,header,body,url
0,日経クロステック トップ建築フォトギャラリー,2006-05-08,中崎 隆司,連棟の切妻と復元施設に,"南から見下ろす（写真：細谷 陽二郎）


　石垣と白壁が続く。石段の先に大きな門が構えている。江戸時代に幕府の直轄地として行政や外交、貿易などをつかさどった長崎奉行所立山役所の一部を博物館のシンボルとして復元した。施設全体は近世長崎の海外交流史を展示テーマとし、同奉行所があった場所に位置する。


長崎歴史文化博物館（長崎県長崎市）
・設計：黒川紀章建築都市設計事務所（建築）ほか
・施工：竹中工務店・親和土木・古賀建設JV（建築）ほか南から見下ろす（写真：細谷 陽二郎）石垣と白壁が続く。石段の先に大きな門が構えている。江戸時代に幕府の直轄地として行政や外交、貿易などをつかさどった長崎奉行所立山役所の一部を博物館のシンボルとして復元した。施設全体は近世長崎の海外交流史を展示テーマとし、同奉行所があった場所に位置する。長崎歴史文化博物館（長崎県長崎市）
・設計：黒川紀章建築都市設計事務所（建築）ほか
・施工：竹中工務店・親和土木・古賀建設JV（建築）ほか会員の方はこちら有料会員「春割」実施中！【春割実施中】日経電子版セットで２カ月無料日経電子版セットだと日経クロステックが月々650円お得詳しくは日経クロステック有料会員お申し込みのページで。“特等席”から未来づくりの最前線を追う仕事ですあなたの専門知識や経験を生かして、「日経クロステック」の記事や書籍の企画、取材・執筆・編集を担う編集記者（正社員）にトライしませんか。編集の経験は問いません。コミュニケーション能力が高く、企画力や実行力があり、好奇心旺盛な方を求めています。詳しい情報を見る日経BPはエンジニアや企画・営業も募集中次ページ （前のページから続く）奉行所の当時の様子を示す絵...",https://xtech.nikkei.com/kn/article/building/photo/20061214/501577/
