,topic,time,vender,header,body,url
0,日経クロステック トップ建築フォトギャラリー,2006-05-22,佐野 由佳,エンボス鉄板と光がつくる彫刻たちの居場所,"北西から見た外観。外壁はコールテン鋼をエンボス加工したもの（写真：上田 宏）


　宮城県塩釜市内の細い道が入り組んだ住宅街。突然視界が開ける高台に菅野（かんの）美術館は建っている。明らかに周りの住宅とは違う要塞のような、倉庫のような無愛想な顔つきと、端正で瀟洒（しょうしゃ）なたたずまいとを併せ持つ。


菅野美術館（宮城県塩釜市）
・設計：阿部仁史アトリエ
・施工：鹿島北西から見た外観。外壁はコールテン鋼をエンボス加工したもの（写真：上田 宏）宮城県塩釜市内の細い道が入り組んだ住宅街。突然視界が開ける高台に菅野（かんの）美術館は建っている。明らかに周りの住宅とは違う要塞のような、倉庫のような無愛想な顔つきと、端正で瀟洒（しょうしゃ）なたたずまいとを併せ持つ。菅野美術館（宮城県塩釜市）
・設計：阿部仁史アトリエ
・施工：鹿島会員の方はこちら有料会員「春割」実施中！【春割実施中】日経電子版セットで２カ月無料日経電子版セットだと日経クロステックが月々650円お得詳しくは日経クロステック有料会員お申し込みのページで。“特等席”から未来づくりの最前線を追う仕事ですあなたの専門知識や経験を生かして、「日経クロステック」の記事や書籍の企画、取材・執筆・編集を担う編集記者（正社員）にトライしませんか。編集の経験は問いません。コミュニケーション能力が高く、企画力や実行力があり、好奇心旺盛な方を求めています。詳しい情報を見る日経BPはエンジニアや企画・営業も募集中次ページ （前のページから続く）「空間と彫刻のマリアージュ...",https://xtech.nikkei.com/kn/article/building/photo/20061214/501576/
