,topic,time,vender,header,body,url
0,日経クロステック トップ建築フォトギャラリー,2006-04-10,萩原 詩子,10棟に分けて外部との多様な関係を構築,"敷地の中ほどにあるB棟。1階はダイニングキッチンで、はしごの上にも部屋がある。写真左手はガラス張りの渡り廊下を介して地下1階・地上3階建てのA棟につながる。正面は浴室だけのD棟。いずれも建て主が使う棟で、建物に囲まれた空地が庭になる（写真：吉田 誠）


　私鉄の小さな駅を降り、古びた家屋が並ぶ細い道をしばらく行くと、大小の白い箱を並べたような、不思議な景色が見えてくる。道路と敷地の間には塀も門もなく、重なり合って建つ箱のすき間が迷路のように入り組む。


森山邸（東京都）
・設計：西沢立衛建築設計事務所
・施工：施工：平成建設敷地の中ほどにあるB棟。1階はダイニングキッチンで、はしごの上にも部屋がある。写真左手はガラス張りの渡り廊下を介して地下1階・地上3階建てのA棟につながる。正面は浴室だけのD棟。いずれも建て主が使う棟で、建物に囲まれた空地が庭になる（写真：吉田 誠）私鉄の小さな駅を降り、古びた家屋が並ぶ細い道をしばらく行くと、大小の白い箱を並べたような、不思議な景色が見えてくる。道路と敷地の間には塀も門もなく、重なり合って建つ箱のすき間が迷路のように入り組む。森山邸（東京都）
・設計：西沢立衛建築設計事務所
・施工：施工：平成建設会員の方はこちら有料会員「春割」実施中！【春割実施中】日経電子版セットで２カ月無料日経電子版セットだと日経クロステックが月々650円お得詳しくは日経クロステック有料会員お申し込みのページで。“特等席”から未来づくりの最前線を追う仕事ですあなたの専門知識や経験を生かして、「日経クロステック」の記事や書籍の企画、取材・執筆・編集を担う編集記者（正社員）にトライしませんか。編集の経験は問いません。コミュニケーション能力が高く、企画力や実行力があり、好奇心旺盛な方を求めています。詳しい情報を見る日経BPはエンジニアや企画・営業も募集中",https://xtech.nikkei.com/kn/article/building/photo/20061214/501620/
