,topic,time,vender,header,body,url
0,日経クロステック トップ建築フォトギャラリー,2005-06-27,西山 麻夕美,黒い鉄板で覆われた原宿の異空間,"1階北東側の「アルマーニカーザ」スペース（写真：寺尾 豊）


　若者でにぎわう東京・原宿のキャットストリート沿いに、この4月、インターオフィスの3店目のショップとなる「hhstyle.com/casa」がオープンした。インターオフィスは、近年のデザイナーズ家具ブームのきっかけをつくった輸入家具販売会社。本店は、妹島和世氏の設計による透明感のあるガラスの建築で、同じ通り沿いの一軒おいた隣に建つ。3店目を設計したのは安藤忠雄氏。インターオフィス会長の原田孝行氏は依頼にあたって、「今までの安藤建築と違う世界初で、本店とは異なる建築にしたい」と希望したという。


hhstyle.com/casa（東京都渋谷区）
・設計：安藤忠雄建築研究所
・施工：竹中工務店1階北東側の「アルマーニカーザ」スペース（写真：寺尾 豊）若者でにぎわう東京・原宿のキャットストリート沿いに、この4月、インターオフィスの3店目のショップとなる「hhstyle.com/casa」がオープンした。インターオフィスは、近年のデザイナーズ家具ブームのきっかけをつくった輸入家具販売会社。本店は、妹島和世氏の設計による透明感のあるガラスの建築で、同じ通り沿いの一軒おいた隣に建つ。3店目を設計したのは安藤忠雄氏。インターオフィス会長の原田孝行氏は依頼にあたって、「今までの安藤建築と違う世界初で、本店とは異なる建築にしたい」と希望したという。hhstyle.com/casa（東京都渋谷区）
・設計：安藤忠雄建築研究所
・施工：竹中工務店会員の方はこちら有料会員「春割」実施中！【春割実施中】日経電子版セットで２カ月無料日経電子版セットだと日経クロステックが月々650円お得詳しくは日経クロステック有料会員お申し込みのページで。“特等席”から未来づくりの最前線を追う仕事ですあなたの専門知識や経験を生かして、「日経クロステック」の記事や書籍の企画、取材・執筆・編集を担う編集記者（正社員）にトライしませんか。編集の経験は問いません。コミュニケーション能力が高く、企画力や実行力があり、好奇心旺盛な方を求めています。詳しい情報を見る日経BPはエンジニアや企画・営業も募集中次ページ （前のページから続く）安藤氏は現地を見て、「直感...",https://xtech.nikkei.com/kn/article/building/photo/20061214/501663/
