,topic,time,vender,header,body,url
0,日経クロステック トップ建築フォトギャラリー,2005-11-14,,町に溶け込む石州瓦と四角い中庭,"回廊で囲まれた中庭広場。せっ器質タイルを敷き詰め、25m四方の水盤があるだけのプレーンな空間だ（写真：吉田 誠）


　10月8日のオープン当日、開館記念コンサートを待つ人の列は回廊を半周した。出演者は島根県出身のテノール歌手、錦織健ほか。1500人を収容する、いわみ芸術劇場大ホールのこけら落とし公演だ。隣接する美術館と劇場は回廊で緩やかに結ばれ、人々がにぎやかに行き来している。


島根県芸術文化センター（島根県益田市）
・設計：内藤廣建築設計事務所
・施工：大成建設・大畑建設・日興建設JVほか回廊で囲まれた中庭広場。せっ器質タイルを敷き詰め、25m四方の水盤があるだけのプレーンな空間だ（写真：吉田 誠）10月8日のオープン当日、開館記念コンサートを待つ人の列は回廊を半周した。出演者は島根県出身のテノール歌手、錦織健ほか。1500人を収容する、いわみ芸術劇場大ホールのこけら落とし公演だ。隣接する美術館と劇場は回廊で緩やかに結ばれ、人々がにぎやかに行き来している。島根県芸術文化センター（島根県益田市）
・設計：内藤廣建築設計事務所
・施工：大成建設・大畑建設・日興建設JVほか会員の方はこちら有料会員「春割」実施中！【春割実施中】日経電子版セットで２カ月無料日経電子版セットだと日経クロステックが月々650円お得詳しくは日経クロステック有料会員お申し込みのページで。“特等席”から未来づくりの最前線を追う仕事ですあなたの専門知識や経験を生かして、「日経クロステック」の記事や書籍の企画、取材・執筆・編集を担う編集記者（正社員）にトライしませんか。編集の経験は問いません。コミュニケーション能力が高く、企画力や実行力があり、好奇心旺盛な方を求めています。詳しい情報を見る日経BPはエンジニアや企画・営業も募集中次ページ （前のページから続く）「中庭を強い求心力を持つ場...",https://xtech.nikkei.com/kn/article/building/photo/20061214/501614/
