,topic,time,vender,header,body,url
0,日経クロステック トップ建築フォトギャラリー,2005-02-21,,ナニワ魂で復活する路地空間,"夜の法善寺横丁。路地に面して飲食店が立ち並ぶ（写真：乾 芳江）


　長さ約70mの細長い石畳の路地に面して、所狭しと飲食店が軒を連ねる。2度にわたる火災を乗り越えて大阪・ミナミの法善寺横丁にようやく昔ながらのにぎわいが戻ってきた。2004年3月にすべての店舗で営業を再開してから1年近くがたつ。


法善寺横丁（大阪府大阪市）
・街づくり主体：法善寺横丁復興委員会 
・復興協力・計画提案：竹中工務店、佐藤秀、大阪ガス（3社協議会）夜の法善寺横丁。路地に面して飲食店が立ち並ぶ（写真：乾 芳江）長さ約70mの細長い石畳の路地に面して、所狭しと飲食店が軒を連ねる。2度にわたる火災を乗り越えて大阪・ミナミの法善寺横丁にようやく昔ながらのにぎわいが戻ってきた。2004年3月にすべての店舗で営業を再開してから1年近くがたつ。法善寺横丁（大阪府大阪市）
・街づくり主体：法善寺横丁復興委員会 
・復興協力・計画提案：竹中工務店、佐藤秀、大阪ガス（3社協議会）会員の方はこちら有料会員「春割」実施中！【春割実施中】日経電子版セットで２カ月無料日経電子版セットだと日経クロステックが月々650円お得詳しくは日経クロステック有料会員お申し込みのページで。“特等席”から未来づくりの最前線を追う仕事ですあなたの専門知識や経験を生かして、「日経クロステック」の記事や書籍の企画、取材・執筆・編集を担う編集記者（正社員）にトライしませんか。編集の経験は問いません。コミュニケーション能力が高く、企画力や実行力があり、好奇心旺盛な方を求めています。詳しい情報を見る日経BPはエンジニアや企画・営業も募集中次ページ （前のページから続く）道を拡幅すれば「肩が触れ合...",https://xtech.nikkei.com/kn/article/building/photo/20061221/503646/
