,topic,time,vender,header,body,url
0,日経クロステック トップ建築これからのマンション管理を考える,2008-09-22,,老朽マンションを賃貸マンションとして再生する道もある／米山秀隆氏と語る（第1回）,"米山　老朽化したマンションをファンドが買い取って賃貸マンションとして再生するという内容は、たぶんだれも言ったことがないことだろうと思うんですけれども、この構想自体をいますぐ実現できるとは私も思ってはいないんです。たぶん、ファンドに売ると言っても、それはファンドに売ることについて区分所有者全員の合意が必要なわけで、だれかが反対したらできませんからね。

いま、マンションを区分所有権という形で共同で所有することの限界がだんだん現れ始めてきていて、第一世代のマンションがどんどん老朽化している。この傾向は今後も続いていく。国土交通省はそれを何とかして、うまくメンテナンス、維持管理していきたい一方で、所有者が合意できるのであれば、建て替えを促進していきたいという、そういう流れだと思うんです。

けれども、建て替えはたぶん一部のマンションでしか実現できないだろうと私は思います。これだけストックが増えているなかでは、もう少し別な方法で建物の活用の仕方を考えるアイデアが一つあるかなと思うんです。……

村井　米山さんはご専門がマンション管理に特化していないといわれますが、逆に、だからこそ、私はかえってインパクトを感じるんですよ。専門性のしがらみからフリーな視点を持っておられるという意味でね。
……会員の方はこちら有料会員「春割」実施中！【春割実施中】日経電子版セットで２カ月無料日経電子版セットだと日経クロステックが月々650円お得詳しくは日経クロステック有料会員お申し込みのページで。“特等席”から未来づくりの最前線を追う仕事ですあなたの専門知識や経験を生かして、「日経クロステック」の記事や書籍の企画、取材・執筆・編集を担う編集記者（正社員）にトライしませんか。編集の経験は問いません。コミュニケーション能力が高く、企画力や実行力があり、好奇心旺盛な方を求めています。詳しい情報を見る日経BPはエンジニアや企画・営業も募集中次ページ 米山ご案内のように、私はマンション管理などの専門...",https://xtech.nikkei.com/kn/article/mansion/column/20080912/526177/
