,topic,time,vender,header,body,url
0,日経クロステック トップ建築ニュース,2009-07-13,井上 雅義,古民家風の居酒屋をオールLEDで,"“商品”や“雰囲気”を大切にする商空間でもLEDの活用事例が増えている。LEDの光も多様になってきたからだ。白熱電球に匹敵する落ち着いた雰囲気が演出できるようになった。「商品を美しく見せる」ための演色性も向上している。LEDを活用した飲食店・物販店の照明手法を計6回に渡って連載する。「くつ炉ぎ・うま酒　かこいや霞が関ビル店」（東京都千代田区）環境に貢献するためLEDを導入「くつ炉ぎ・うま酒　かこいや（以下、かこいや）」は、古民家の再生をコンセプトに掲げるチェーン店だ。
2003年の1号店（東京・新宿）を皮切りに、札幌、名古屋などに展開。09年4月に18番目の「霞が関ビル店」をオープンした。同店は日本で初めてのオールLED照明の居酒屋として、08年度の環境省「省エネ照明デザインモデル事業」に採択された。同規模の施設と比べ、照明の電力使用量を約5分の1に削減できた。通常の光源であれば1万1076Wになるところを、すべてLEDにすることで2104Wになった。CO2排出量は約81％削減できたと試算している。「かこいや」など飲食店約200店舗を展開するサッポロライオンは、CSRの一環として「省エネ照明デザインモデル事業」に応募を決めた。「最初はLEDの光は居酒屋に合わないという意見もあったが、環境貢献はグループ全体の方針でもあり、LED導入を決めた」とサッポロライオン経営企画室の西村礼佳氏は振り返る。日本古来の光と影のバランス設計を手掛けたミクプランニングの篠崎久氏は、LED照明の導入を機に「店内の明るさ」に対する考え方を見直した。一般的にダイニング照明の場合、客席の照度を下げても、入り口や通路のベース照明はかなり明るくする。しかし、今回は店の入り口から思い切って照度を落として陰影を出した。「かこいや」の照度分布図。図面下の中央が入り口で、上に向かって左に折れるL字形の明るいゾーンが通路部分だ。通路面と通路壁面の照度分布の違いが分かる。通路から枝分かれしている暗めの箱型スペースは個室。通路と客席とは明暗にメリハリを付けた既存のソケットをそのまま活用レール式のLEDダウンライト（2.5W）は、フェニックスの2.5W電球色（3000K）●従来型の照明を使用した店舗●LEDで消費電力が5分の1に一般的にLEDランプはレンズを装着する構造になっているので、配光角が明確で光の指向性も高い。その特徴を生かして壁にスポットを当てたり、ペンダントの輝き感を表現したりすることも可能になる。光の色合いがLEDの課題の一つだが、「かこいや」では発光面にフィルターを付けることで暖色に近づけた。LEDは照明設計の創意工夫が発揮できるチャンス。「かこいや」はLED照明を使って行灯のような「和の懐かしい明かり」を実現している。［建物概要］売場面積：201.37m2(客席、厨房）
発注・運営者：サッポロライオン
プロデュース：ミクプランニング
照明設計者：ミクプランニング（篠崎久）
設計協力者：ライトウェーブ（小野貴/器具開発協力、実験協力）
施工者：ミクプランニング（大迫尚太郎）
設計期間：2008年12月2日～09年2月12日
施工期間：2008年12月18日～09年2月12日
竣工：2009年3月18日
開業：2009年4月10日［使用製品］＜訂正＞初出時に本文および表で照明の電力使用量を「1万1076kW」「2104kW」と記述しましたが、いずれも単位をkWからWに訂正しました。（2009年7月14日15時10分）",https://xtech.nikkei.com/kn/article/building/news/20090710/533941/
