,topic,time,vender,header,body,url
0,日経クロステック トップ建築2014年5月10日号,2014-05-08,講演録構成：松浦 隆幸、橋場 一男、加藤 光男、池谷 和浩、茂木 俊輔、山口 厚,東京から日本が変わる、そして世界へ,"日経アーキテクチュアをはじめとする日経BP社の建設系メディアなどは、2020年に向けて大きく変貌する東京や日本の姿を予見し、建築や都市の様々な課題と解決策を浮き彫りにするプロジェクト「TARGET2020～東京から日本が変わる、そして世界へ～」を展開している。その一環として、3月にシンポジウムを開催した。当日は約1000人の来場者であふれ、期待や関心の高さをうかがわせた。建築・住宅関連の講演の模様をリポートする。（日経アーキテクチュア）背景写真：安藤忠雄氏の基調講演（写真：渡辺 慎一郎）目次基調講演1

ビジョンを持って魅力ある都市へ建築家　安藤 忠雄氏基調講演2

2020年は通過点東京の街づくり東京都都市整備局理事　佐野 克彦氏建築エネルギートラック
低炭素社会を実現する建築最前線建築の安全・安心トラック
設計者がいま提案すべき安全対策住宅の安全・安心トラック
住宅品質に関わる地盤リスクとその対策集客施設トラック
人が集まる快適空間新・公民連携（PPP・PFI）トラック
公民連携の成果を極大化する公共施設マネジメント〔開催概要〕
TARGET2020シンポジウム　～東京から日本が変わる、そして世界へ～※講演者の肩書は原則として講演当時関連書籍[ 購入する ]amazon(アマゾン)

[ 購入する ][ 購入する ]",https://xtech.nikkei.com/kn/article/nad/mag/20140428/661112/
