,topic,time,vender,header,body,url
0,日経クロステック トップ土木新製品・新サービス（土木）,2001-12-07,,2種類の土砂コンベヤーを開発、日立造船が,"エア浮上式屈曲装置は，ベルトの走行方向に対して斜めに配置した円筒面にベルトを沿わせ，ベルトコンベヤーの走行方向を変えるもの。ベルトの走行方向を0～120度の範囲で曲げられる。これまで複数台のコンベヤーが必要だった個所も一台のコンベヤーで済む。屈曲装置の構造が単純なので，メンテナンスも容易だ。
　またHi-スクリューコンベヤーは，土砂などを垂直方向に搬出する装置。スクリューを複数，継ぎ足して使うこともでき，50m以上の長さにも対応する。
（日経コンストラクション2001年12月14日号）

写真中央の円筒部がエア浮上式屈曲装置。左側から来たベルトは屈曲装置を通過した後，いったん後方に設置したプーリーを通り，右手前の方向に流れる。搬送する土砂は，屈曲部で一度載せ替える

この記事の目次へ戻るまたHi-スクリューコンベヤーは，土砂などを垂直方向に搬出する装置。スクリューを複数，継ぎ足して使うこともでき，50m以上の長さにも対応する。
（日経コンストラクション2001年12月14日号）

写真中央の円筒部がエア浮上式屈曲装置。左側から来たベルトは屈曲装置を通過した後，いったん後方に設置したプーリーを通り，右手前の方向に流れる。搬送する土砂は，屈曲部で一度載せ替える

この記事の目次へ戻る写真中央の円筒部がエア浮上式屈曲装置。左側から来たベルトは屈曲装置を通過した後，いったん後方に設置したプーリーを通り，右手前の方向に流れる。搬送する土砂は，屈曲部で一度載せ替える

この記事の目次へ戻る写真中央の円筒部がエア浮上式屈曲装置。左側から来たベルトは屈曲装置を通過した後，いったん後方に設置したプーリーを通り，右手前の方向に流れる。搬送する土砂は，屈曲部で一度載せ替える",https://xtech.nikkei.com/kn/article/const/info/20011207/101864/
