,topic,time,vender,header,body,url
0,日経クロステック トップ土木新製品・新サービス（土木）,2002-11-29,,駐輪場用の固定式空気入れ,"駐輪場のサービス機器として利用できる手動式の空気入れ。自転車に乗る直前や乗った直後などに便利に使える。本体はステンレス製。屋外にも設置できるよう，雨水の浸入を防ぐ特殊構造とした。蓄圧タンク付きなので，女性でも無理なく扱える。メンテナンスは注油とパッキンの交換だけでよい。
価格は，アンカーで固定する据え置きタイプが11万8000円。
問い合わせ：ライブプロモーション
電話：03-3230-4392
URL：http://www.live-p.co.jp/ecostand/
掲載号：日経アーキテクチュア2002年12月9日号


この記事の目次へ戻る問い合わせ：ライブプロモーション
電話：03-3230-4392
URL：http://www.live-p.co.jp/ecostand/
掲載号：日経アーキテクチュア2002年12月9日号


この記事の目次へ戻る掲載号：日経アーキテクチュア2002年12月9日号


この記事の目次へ戻る",https://xtech.nikkei.com/kn/article/const/info/20021129/108080/
