,topic,time,vender,header,body,url
0,日経クロステック トップ土木新製品・新サービス（土木）,2002-12-11,,防水性と防汚性を両立させた コンクリート打ち放し仕上げ,"●打ち放しコンクリートの表面に、2層の防水層と光触媒を積層。特殊防水材がコンクリートに深く浸透して緻密化した疎水層を形成、光触媒の酸化力にも損なわれない強固な防水性を実現。汚れを分解、自浄して外壁を美しく保ち、また高い耐候性を付加する。水性で、環境に配慮。
●価格は、4400～5300円／m2（1000m2以上の場合）。
問合：ニチエー吉田
電話：0120・220・333




（日経ホームビルダー2003年1月号）
この記事の目次へ戻る問合：ニチエー吉田
電話：0120・220・333




（日経ホームビルダー2003年1月号）
この記事の目次へ戻る（日経ホームビルダー2003年1月号）
この記事の目次へ戻る（日経ホームビルダー2003年1月号）
この記事の目次へ戻る",https://xtech.nikkei.com/kn/article/const/info/20021211/108245/
