,topic,time,vender,header,body,url
0,日経クロステック トップ土木新製品・新サービス（土木）,2003-07-14,,音で水平を知らせる 受光器対応レーザー基準出し器,"●受光器の位置がレーザー基準線に合致すると、音とランプの点灯で知らせる。レーザー光が見えにくい明るい現場や遠距離でも、正確、迅速に基準出しができる。受光器は、直径約40mまで対応可能。電源は、本体が単3乾電池2本、受光器が9V乾電池1本を使用。機能を高めながら価格は据え置いた。
●価格は、本体と受光器のセットが9万6000円、三脚付きが10万円。
問合：タジマツール
電話：0120・125577


 
（日経ホームビルダー2003年8月号）
この記事の目次へ戻る問合：タジマツール
電話：0120・125577


 
（日経ホームビルダー2003年8月号）
この記事の目次へ戻る（日経ホームビルダー2003年8月号）
この記事の目次へ戻る（日経ホームビルダー2003年8月号）
この記事の目次へ戻るこの記事の目次へ戻る",https://xtech.nikkei.com/kn/article/const/info/20030714/111576/
