,topic,time,vender,header,body,url
0,日経クロステック トップ土木新製品・新サービス（土木）,2004-02-09,,広告として利用できる建築足場用シート,"●写真やパース、イラストなどを盛り込んだオリジナルデザインを施すことで、屋外広告として活用できる足場用シート。1枚からオーダー可能。少ロットにはインクジェット出力、数がまとまればシルク印刷、画像を使わない場合は特色指定など、数と用途に応じてタイプを選べる。
●価格は、1800mm×1800mmのインクジェットタイプが3万2000円／枚など。
問合：ドットコミュニケーション
電話：03・5912・5341




（日経ホームビルダー2004年3月号）
この記事の目次へ戻る問合：ドットコミュニケーション
電話：03・5912・5341




（日経ホームビルダー2004年3月号）
この記事の目次へ戻る（日経ホームビルダー2004年3月号）
この記事の目次へ戻る（日経ホームビルダー2004年3月号）
この記事の目次へ戻る",https://xtech.nikkei.com/kn/article/const/info/20040209/114848/
