,topic,time,vender,header,body,url
0,日経クロステック トップ土木新製品・新サービス（土木）,2004-09-13,,ハンディタイプの高精度レーザー距離計,"●高精度の測定を手軽に行える、ハンディタイプのレーザー距離計。距離のほか面積・容積測定やピタゴラス機能などの高度な測定機能、メモリー機能を搭載。屋内外の0.2～200mの距離を±1.5mmの高精度で測定する。Bluetoothに対応し、現場で測定値をパソコンやPDAへ無線送信できる。
●価格は、10万4790円。
問合：ライカジオシステムズ
電話：03・5940・3101





（日経ホームビルダー2004年10月号）
この記事の目次へ戻る問合：ライカジオシステムズ
電話：03・5940・3101





（日経ホームビルダー2004年10月号）
この記事の目次へ戻る（日経ホームビルダー2004年10月号）
この記事の目次へ戻る（日経ホームビルダー2004年10月号）
この記事の目次へ戻る",https://xtech.nikkei.com/kn/article/const/info/20040913/118510/
