,topic,time,vender,header,body,url
0,日経クロステック トップ土木新製品・新サービス（土木）,2005-07-13,,施工時間を短縮扱いやすい建築用ターンバックル,"●軸部にターンバックル胴がないスマートなデザイン。ターンバックル胴位置を気にすることなく、壁際などのスペース確保が難しい場所にも施工できる。左右面対称の構造で取り付け方向がないため、従来の枠式に比べて施工時間を大幅に短縮。溶接工程もなく、強度が平均化し、安全性も高い。

●価格については、問い合わせを。

問合：港製器工業

電話：072・677・6641





（日経ホームビルダー2005年8月号）
この記事の目次へ戻る問合：港製器工業

電話：072・677・6641





（日経ホームビルダー2005年8月号）
この記事の目次へ戻る（日経ホームビルダー2005年8月号）
この記事の目次へ戻る（日経ホームビルダー2005年8月号）
この記事の目次へ戻る",https://xtech.nikkei.com/kn/article/const/info/20050713/123643/
