,topic,time,vender,header,body,url
0,日経クロステック トップ土木キャリアアップ・サイト新着（講座一覧）,2012-09-03,,技術士一直線2012,"技術士取得を目指す実務者に必読の講座です。このほかにも「技術士取得支援サイト」には試験の過去問題や想定問題など、資格取得に役立つ情報が満載です。こんな方に…土木の実務者
建築の実務者ご覧になるには…この講座の各記事はプレミアム会員専用です。全文をご覧になるには、日経アーキテクチュア・プレミアム会員またはケンプラッツ・プレミアム会員へのお申し込みが必要です。［詳細はこちら］技術士一直線2012：講座の内容（連載中）2011年度の出題傾向と12年度の戦略 - 東日本大震災以降の変化は必ず押さえる（PDF）
増補版：12年度の戦略 （2012/01/10）専門論文の出題傾向と知識の整理（1） - 国の審議会の議事録に「解答」あり（PDF）
増補版：計画系の専門論文の資料 （2012/02/16）専門論文の出題傾向と知識の整理（2） - キーワードごとに背景や課題を整理（PDF）
増補版：実務系の専門論文の資料 （2012/03/13）受験申込書の書き方／専門論文添削例（1） - 口頭試験を見据えて業務経歴記入（PDF）
増補版：計画系の専門論文の構成例 （2012/04/09）専門論文の構成と添削例（2） - 実務系は本論から書く論文構成に（PDF）
増補版：専門論文の添削例 （2012/05/16）総合技術監理部門の専門論文の構成と添削例 - リスクマネジメントの手順で記述（PDF）
増補版：総合技術監理部門の専門論文の添削例 （2012/06/11）一般論文の構成と添削例、筆記試験直前対策 - 解決策から遡って課題や背景を抽出（PDF）
増補版：一般論文の模範解答例 （2012/07/11）技術的体験論文の位置付けと添削例（1）- 試験官は導入部で論文の質を見極める（PDF）
増補版：技術的体験論文の位置付けと業務概要の書き方 （2012/08/20）技術的体験論文の添削例（2） - 課題と問題点が不明確では減点要因に（PDF）
増補版：技術的体験論文の模範解答例 （2012/09/14）技術的体験論文の添削例（3） - 解決策をどう書くかが体験論文の全て（PDF）
増補版：技術的体験論文の模範解答例 （2012/10/18）口頭試験への備え方（1） - 簡潔な回答で数多くの質問を受ける（PDF）
増補版：口頭試験の想定問題と解答例（2012/11/13）※この講座は、日経コンストラクション2012年1月9日号から隔号で連載している記事で構成しています。",https://xtech.nikkei.com/kn/article/knp/plus/20120817/579829/
