,topic,time,vender,header,body,url
0,日経クロステック トップ土木新製品・新サービス（土木）,2012-12-10,,首への負担少ない電動ファン付き呼吸用保護具,"興研は、電動ファン付き呼吸用保護具「ブレスリンクブロワーマスクサカヰ式 BL-1005」を発売した。特徴
■マスクを着用し一呼吸で自動的にスイッチが入る。呼吸に高精度に追随し、息を吸うときに必要量の送風を行い、吐くときには送風を抑える。■捕集効率が高く、通気抵抗が低い静電フィルターを採用。これにより、ファンの送風効率が高まり、消費電力の低減と電池の小型化を実現した。■バッテリーとフィルターを含めた重量は約270gと軽量で、首への負担が少ない。オゾン臭対策の活性炭配合フィルターとの併用も可能。下方視野性が良く、アーク溶接作業や粉じん作業などに使える。価格
3万6750円（日経コンストラクション「12月10日号」より）

この記事の目次へ戻る（日経コンストラクション「12月10日号」より）

この記事の目次へ戻る（日経コンストラクション「12月10日号」より）",https://xtech.nikkei.com/kn/article/knp/product/20121210/594952/
