,topic,time,vender,header,body,url
0,日経クロステック トップ土木新製品・新サービス（土木）,2013-02-12,,繰り返し利用できる水のう,"太陽工業は、土のうに代わって、越水や浸水などの被害を防ぐ三角水のう「デルタチューブ」を発売した。特徴
■ポリエステル繊維に塩化ビニールをコーティングした防水シートの袋体に、現場で注水して使用する。■注水圧力0.3MPa以下の小型給水ポンプを使う。少人数でも短時間で構築できる。河川の水を充填することも可能。使用後はワンタッチで排水でき、再利用もできる。■平常時は折り畳んでコンパクトに収納できる。約20～30kgと軽量なので、持ち運びも容易。適用水深50cmの標準型と、同80cmの大型の2種類。標準型の1ユニットのサイズは、幅1.2m、高さ0.6m、長さ6ｍ。容積は約2.5m3。価格
23万9400～31万800円「日経コンストラクション 2/11号」より
この記事の目次へ戻る「日経コンストラクション 2/11号」より
この記事の目次へ戻る",https://xtech.nikkei.com/kn/article/knp/product/20130212/602510/
