,topic,time,vender,header,body,url
0,日経クロステック トップ土木新製品・新サービス（土木）,2013-02-12,,広いシールド面で目元を保護する高通気性ヘルメット,"谷沢製作所は、高通気性ヘルメットシリーズの最新版「ヘルメッシュ? ST#1330V-SE」を発売した。特徴
■目元を保護するシールド面の幅は258mm。従来品より約40％広くして、横からの飛来物に対する保護性能を向上させた。■メガネやマスクと併用する場合は、シールド面を引き下げた後、シールド面を斜め前に押し上げ、顔との隙間を確保すれば調節できる。シールド面だけの交換も可能。■保護帽は2層構造になっており、正面の上下2カ所に設けた開口部から風を取り込む。シールド面の収納時でも温度や湿度を効果的に下げられる。ワンタッチでサイズを調節でき、あごひもや内装の着脱も容易。価格
1万800円「日経コンストラクション 2/11号」より

この記事の目次へ戻る「日経コンストラクション 2/11号」より

この記事の目次へ戻る「日経コンストラクション 2/11号」より",https://xtech.nikkei.com/kn/article/knp/product/20130212/602514/
