,topic,time,vender,header,body,url
0,日経クロステック トップ土木新製品・新サービス（土木）,2013-06-24,,軽い力で展開可能なヘルメット,"イエローは、折り畳み式ヘルメット「タタメット」の改良版「タタメットBCP」を発売した。特徴
■これまでの折り畳み式ヘルメットでは、展開や折り畳み時に、ある程度の力やコツを要した。開発した製品には、バネ内蔵の自動ロック機構を装着して、より簡単に使えるようにした。■折り畳み時の厚さは約35mm。■ゴムバンドとアジャスターの採用で、簡単に頭のサイズに合わせられる。着用時の快適性が増した。■ロゴステッカーに反射素材を使用しているので、居場所を示しやすい。閉じ込めなどに遭った場合に、自分の居場所を知らせるホイッスルも標準装備した。価格
4515円「日経コンストラクション6/24号新製品」より



この記事の目次へ戻る「日経コンストラクション6/24号新製品」より



この記事の目次へ戻る「日経コンストラクション6/24号新製品」より",https://xtech.nikkei.com/kn/article/knp/product/20130624/621232/
