,topic,time,vender,header,body,url
0,日経クロステック トップ土木新製品・新サービス（土木）,2013-10-15,,違う形式のファイルを統合できるファイルコンバーター,"オーシャンブリッジは、Office文書やCADデータなどをPDFやTIFFなどに変換するマルチフォーマットコンバーター「Blazon Enterprise」を発売した。特徴
■文書や図面、画像など、各種ファイルをPDFやTIFFに変換できる。形式やサイズが異なるファイルを一つにまとめることも可能。■指定したフォルダにファイルを追加するだけで、自動的に指定形式に変換することもできる。■変換時に、透かし文字やスタンプなどを加えられる。セキュリティー対策にも対応しており、独自の暗号化形式であるCSFに変換すると専用のビューアーのみで表示できる。パスワードも設定可能だ。価格
157万5000円「日経コンストラクション10/14号　新製品」より

この記事の目次へ戻る「日経コンストラクション10/14号　新製品」より

この記事の目次へ戻る「日経コンストラクション10/14号　新製品」より",https://xtech.nikkei.com/kn/article/knp/product/20131015/635831/
