,topic,time,vender,header,body,url
0,日経クロステック トップ土木2012年度会計検査報告,2014-02-10,奥野 慶四郎,繰り返される基本的なミス,"モルタルの吹き付け厚不足に配筋ミス──。会計検査院の2012年度会計検査で並んだのは、やはり“おなじみ”の指摘だ。いずれも原因は、基準書の理解不足や設計時の想定ミスといった基本的なタイプばかり。ミスの撲滅には地道な取り組みしかない。調査官の視点やチェック手法も参考にしたい。※解説以外の閲読には日経コンストラクション読者会員、日経アーキテクチュア・プレミアム会員またはケンプラッツ・プレミアム会員への登録が必要です。道路
			
配筋設計を誤ってカルバートが強度不足に
粗雑工事で打ち継ぎ箇所から水漏れ
道路改修後の路面に大きな段差
農家には迷惑だった農道整備


河川
			
設計ミスで落差工の安全度が低下
基準書の理解不足で樋管を設計ミス


水路
			
車両の横断を計算に入れずに強度不足
コンクリート蓋の荷重を忘れて強度不足


法面
			
モルタルの吹き付け厚さが著しく不足
法面植生が「無策」と「放置」で台無しに


橋
			
橋脚の巻き立て補強で基礎の耐震性が低下


港湾
			
陸閘の改良工事で生じた凡ミス次ページ 調査官の視点でミスの芽を摘み取る",https://xtech.nikkei.com/kn/article/const/column/20140207/650790/
