,topic,time,vender,header,body,url
0,日経クロステック トップ土木新製品・新サービス（土木）,2014-03-24,,耐久性と意匠性を追求したスニーカー,"ミドリ安全は、耐久性と意匠性を兼ね備えたプロテクティブスニーカー「ワークプラスエア WPA-110」を発売した。特徴
■屈曲部やつま先など傷付きやすい部分には、ベロア革を使用して耐久性を高めている。側部にはコントラストの強いグラデーションを施し、意匠性を追求した。■かかと部分に大型エアクッションを採用して、歩行時の衝撃を吸収。足の疲労を軽減する。クッションレイアウトを内外で非対称にして、内側への倒れこみを起りにくくし、足首の内転を防ぐ。■鋼製先芯と同じJSAA認定A種の安全性能を持った樹脂製の先芯を採用。軽量化を図った。価格
4500円「日経コンストラクション3/24号　新製品」より

この記事の目次へ戻る「日経コンストラクション3/24号　新製品」より

この記事の目次へ戻る「日経コンストラクション3/24号　新製品」より",https://xtech.nikkei.com/kn/article/knp/product/20140324/656111/
