,topic,time,vender,header,body,url
0,日経クロステック トップ土木新製品・新サービス（土木）,2014-06-23,,支保工を3分の1まで削減できる床板用鋼製型枠,"ヒロセは、スライド式の床板用鋼製型枠「フリースパンフォーム」のリースを始めた。関東・中国地方で先行して開始。今後、全国にも拡大していく予定だ。特徴
■繰り返し使用できるので、使い捨てのコンクリート型枠用合板と比べて経済性が向上する。■長さを自由に調節できるスライド構造を持つ。設置が簡単で、支保工（サポート）を3分の1まで削減可能。根太材が不要なため、解体時に生じる騒音を小さくできる。■転用が容易で仮設材が減る。材料費や労務費を30％から50％抑制可能。■幅は200、390、600mmの3タイプ、長さは2.5mから3m、2mから2.5mなどの仕様を用意している。価格
要見積もり「日経コンストラクション6/23号　新製品」より



この記事の目次へ戻る「日経コンストラクション6/23号　新製品」より



この記事の目次へ戻る「日経コンストラクション6/23号　新製品」より",https://xtech.nikkei.com/kn/article/knp/product/20140623/667933/
