,topic,time,vender,header,body,url
0,日経クロステック トップ土木新製品・新サービス（土木）,2014-09-08,,レベル2地震時を検討できる矢板式河川護岸の設計計算プログラム,"フォーラムエイトは、河川護岸における自立式矢板の設計計算プログラム「矢板式河川護岸の設計計算」を発売した。特徴
■全国防災協会の「災害復旧工事の設計要領」の最新版に対応しており、慣用法で矢板壁を検討できる。■国土交通省が制定した「河川構造物の耐震性能照査指針（平成24年）」に準拠したレベル2地震時の検討や、液状化の影響の考慮、「多段盛り土」の検討が可能だ。■「Engineer’s Studio」と呼ぶ同社の解析プログラムのソルバーを用いた断面力や変位の計算に対応する。弾塑性法を用いることで、慣用法では計算できない鉛直方向の変位量を得られる。価格
20万円（税抜き）「日経コンストラクション9/8号　新製品」より

この記事の目次へ戻る「日経コンストラクション9/8号　新製品」より

この記事の目次へ戻る「日経コンストラクション9/8号　新製品」より",https://xtech.nikkei.com/kn/article/knp/product/20140908/676093/
