,topic,time,vender,header,body,url
0,日経クロステック トップ土木新製品・新サービス（土木）,2015-01-12,,3種類の圧入工法に対応する杭圧入引き抜き機,"技研製作所は、無公害型の油圧式杭圧入引き抜き機「サイレントパイラー F201」を発売した。特徴
■「モジュール化設計（構成部品の標準化）」に基づいて、高機能・長寿命化を実現した「Fシリーズ」の最新モデル。■広範な地盤条件と施工環境に対応して、最適な圧入施工を行える。1台の機械で「単独圧入」、「ウオータージェット併用圧入」、「硬質地盤圧入」の3種類の圧入工法を使える。■圧入情報や機械情報などの各種情報を圧入中にリアルタイムで把握できる情報端末「G-PAD」など、先進の施工管理技術と機械保全システムを盛り込み、圧入施工を管理しやすくした。価格
約2億4300万円（税抜き）「日経コンストラクション1/12号　新製品」より

この記事の目次へ戻る「日経コンストラクション1/12号　新製品」より

この記事の目次へ戻る「日経コンストラクション1/12号　新製品」より",https://xtech.nikkei.com/kn/article/knp/product/20150109/688475/
