,topic,time,vender,header,body,url
0,日経クロステック トップ土木新製品・新サービス（土木）,2015-01-26,,データをExcel形式に出力できる工事写真管理ソフト,"オリンパスイメージングは、NECソリューションイノベータ、ルクレと共同開発した工事写真管理ソフト「蔵衛門御用達15」を発売した。特徴
■従来からのドラッグ＆ドロップを中心とした直感的な操作を継承。工事写真の取り込みから台帳の作成・管理までをスムーズに行える。■新バージョンでは、アルバムに登録した写真や工事写真情報、文章をExcelファイルに出力できる「データ活用機能」を追加。チェックシートの作成や工事写真の登録状況の確認などに活用できる。■「Professional」版では各官公庁の最新要領やNEXCO、首都高速道路会社の基準などに準拠した電子納品データ形式での入出力が行える。価格
5万円～（Professiona1版、税抜き）「日経コンストラクション1/26号新製品」より

この記事の目次へ戻る「日経コンストラクション1/26号新製品」より

この記事の目次へ戻る「日経コンストラクション1/26号新製品」より",https://xtech.nikkei.com/kn/article/knp/product/20150126/689971/
