,topic,time,vender,header,body,url
0,日経クロステック トップ土木新製品・新サービス（土木）,2015-02-09,,土砂が飛び散るのを防ぐアオリ補強用シート,"クラレプラスチックスは、ダンプカーの荷台周辺を囲むアオリ補強用シート「クラエース」を発売した。特徴
■アオリ補強専用シートは、これまで開発されていなかった。初めての製品化を図った。■ダンプカーの荷台を囲むアオリ部に設置。とがった砕石などで防水シートが破れた際に、積載した土砂が飛び散るのを防ぐ。■ポリエステル繊維を塩ビ樹脂でコーティングした肉厚シートで、耐久性に優れる。平シート化した専用品なので、切ったり折り目を伸ばしたりする作業が不要だ。品名などの印刷表示もなく、すぐに使える。■幅323～807mmの5種類をラインアップしている。価格
要見積もり「日経コンストラクション2/9号新製品」より

この記事の目次へ戻る「日経コンストラクション2/9号新製品」より

この記事の目次へ戻る「日経コンストラクション2/9号新製品」より",https://xtech.nikkei.com/kn/article/knp/product/20150209/691351/
