,topic,time,vender,header,body,url
0,日経クロステック トップ土木新製品・新サービス（土木）,2015-03-23,,天候に関係なく施工できる常温合材,"NIPPOは、常温合材「凹道埋たろう」を発売した。高速道路や幹線道路といった重交通路線の凹みを緊急補修する際に使う。特徴
■凹み部分に敷いて自動車のタイヤなどで踏み固めるだけで済む。専用の転圧機は不要だ。簡単・迅速に路面を補修でき、重交通路線でも十分な強度を発揮する。■首都高速道路会社の舗装設計施工要領に適合しており、高い耐久性と安定性を持つ。従来品と比べて初期供用時の耐流動性が1.8倍に向上している。■低温時でもほぐれやすく、作業性が向上した。雨天時の飛散抵抗性も高まっていて、天候に関係なく施工できる。価格
1袋（10kg）1800円（税抜き）「日経コンストラクション3/23号　新製品」より

この記事の目次へ戻る「日経コンストラクション3/23号　新製品」より

この記事の目次へ戻る「日経コンストラクション3/23号　新製品」より",https://xtech.nikkei.com/kn/article/knp/product/20150325/695791/
