,topic,time,vender,header,body,url
0,日経クロステック トップ土木新製品・新サービス（土木）,2015-05-11,,最大360倍ズームを実現する防犯カメラ,"TOAは、「TRIFORAシリーズ」と呼ぶ防犯カメラシステムの新機種として、「フルHDネットワークPTZカメラ」の屋内用と屋外用の2機種を発売した。特徴
■旋回台、電動ズームレンズを一体化。LANなどのネットワークに直接接続し、映像の監視・制御を行える。■光学30倍ズームと12倍電子ズームによって、最大360倍の高倍率ズームを実現。遠くの被写体も鮮明に撮影可能だ。撮影したい位置を255カ所まで記憶できるだけでなく、それらをワンタッチで呼び出せる。■昼夜を問わず利用できる。例えば、夜間には自動的に感度の高い白黒撮影に切り替えて撮影する。価格
50万～60万円（実売時の見込み価格、税抜き）「日経コンストラクション5/11号　新製品」より

この記事の目次へ戻る「日経コンストラクション5/11号　新製品」より

この記事の目次へ戻る「日経コンストラクション5/11号　新製品」より",https://xtech.nikkei.com/kn/article/knp/product/20150508/699672/
