,topic,time,vender,header,body,url
0,日経クロステック トップ土木新製品・新サービス（土木）,2015-05-25,,3種類を統合した工事用の保険,"日新火災海上保険は、工事業者向けの新たな保険「工事の保険」（工事の保険特約付帯建設工事保険）を発売した。特徴
■工事の内容や種類に応じて、「建設工事保険」、「組立保険」、「土木工事保険」の三つに分かれていた保険を統合。建築、設備、土木など各種工事を一緒に契約できるようにした。■これまで200近くに細分化されていた工種を8種類に集約して、保険料の体系をシンプルにした。■それぞれの工事ごとに契約するスポット契約と1年間の全工事を対象とする包括契約とがある。包括契約では、個々の工事ごとに保険契約する必要がなく、工事ごとの報告や、工期延長などの連絡も不要になる。価格
要見積もり「日経コンストラクション5/25号　新製品」より

この記事の目次へ戻る「日経コンストラクション5/25号　新製品」より

この記事の目次へ戻る「日経コンストラクション5/25号　新製品」より",https://xtech.nikkei.com/kn/article/knp/product/20150525/701091/
